config/miopen/gfx1030_20.HIP.2_20_0_f185a6464-dirty.ufdb.txt
4-64-64-3x3-320-64-64-2-1x1-1x1-1x1-0-NCHW-FP16-F=ConvBinWinogradRxSf2x3g1:0.04396,0,miopenConvolutionFwdAlgoWinograd;ConvBinWinogradRxSf3x2:0.05968,0,miopenConvolutionFwdAlgoWinograd;GemmFwdRest:0.07536,294912,miopenConvolutionFwdAlgoGEMM;ConvDirectNaiveConvFwd:1.10776,0,miopenConvolutionFwdAlgoDirect
320-64-64-3x3-320-64-64-2-1x1-1x1-1x1-0-NCHW-FP16-F=ConvBinWinogradRxSf2x3g1:0.37728,0,miopenConvolutionFwdAlgoWinograd;ConvBinWinogradRxSf3x2:0.69744,0,miopenConvolutionFwdAlgoWinograd;GemmFwdRest:1.26184,23592960,miopenConvolutionFwdAlgoGEMM;ConvDirectNaiveConvFwd:84.678,0,miopenConvolutionFwdAlgoDirect
320-64-64-1x1-320-64-64-2-0x0-1x1-1x1-0-NCHW-FP16-F=ConvBinWinogradRxSf2x3g1:0.3752,0,miopenConvolutionFwdAlgoWinograd;ConvBinWinogradRxSf3x2:0.20508,0,miopenConvolutionFwdAlgoWinograd;GemmFwd1x1_0_1:0.1352,0,miopenConvolutionFwdAlgoGEMM;ConvDirectNaiveConvFwd:11.6119,0,miopenConvolutionFwdAlgoDirect
320-64-64-3x3-320-32-32-2-1x1-2x2-1x1-0-NCHW-FP16-F=ConvBinWinogradRxSf2x3g1:0.39276,0,miopenConvolutionFwdAlgoWinograd;ConvBinWinogradRxSf3x2:0.21584,0,miopenConvolutionFwdAlgoWinograd;GemmFwdRest:0.40832,5898240,miopenConvolutionFwdAlgoGEMM;ConvDirectNaiveConvFwd:20.7669,0,miopenConvolutionFwdAlgoDirect
320-32-32-3x3-640-32-32-2-1x1-1x1-1x1-0-NCHW-FP16-F=ConvBinWinogradRxSf2x3g1:0.20156,0,miopenConvolutionFwdAlgoWinograd;ConvBinWinogradRxSf3x2:0.396241,0,miopenConvolutionFwdAlgoWinograd;GemmFwdRest:0.49432,5898240,miopenConvolutionFwdAlgoGEMM;ConvDirectNaiveConvFwd:40.5045,0,miopenConvolutionFwdAlgoDirect
640-32-32-3x3-640-32-32-2-1x1-1x1-1x1-0-NCHW-FP16-F=ConvBinWinogradRxSf2x3g1:0.37004,0,miopenConvolutionFwdAlgoWinograd;ConvBinWinogradRxSf3x2:0.6828,0,miopenConvolutionFwdAlgoWinograd;GemmFwdRest:1.53824,11796480,miopenConvolutionFwdAlgoGEMM;ConvDirectNaiveConvFwd:79.8522,0,miopenConvolutionFwdAlgoDirect
320-32-32-1x1-640-32-32-2-0x0-1x1-1x1-0-NCHW-FP16-F=ConvBinWinogradRxSf2x3g1:0.19312,0,miopenConvolutionFwdAlgoWinograd;ConvBinWinogradRxSf3x2:0.10972,0,miopenConvolutionFwdAlgoWinograd;GemmFwd1x1_0_1:0.06652,0,miopenConvolutionFwdAlgoGEMM;ConvDirectNaiveConvFwd:5.69696,0,miopenConvolutionFwdAlgoDirect
640-32-32-1x1-640-32-32-2-0x0-1x1-1x1-0-NCHW-FP16-F=ConvBinWinogradRxSf2x3g1:0.36692,0,miopenConvolutionFwdAlgoWinograd;ConvBinWinogradRxSf3x2:0.19328,0,miopenConvolutionFwdAlgoWinograd;GemmFwd1x1_0_1:0.11636,0,miopenConvolutionFwdAlgoGEMM;ConvDirectNaiveConvFwd:11.2496,0,miopenConvolutionFwdAlgoDirect
640-32-32-3x3-640-16-16-2-1x1-2x2-1x1-0-NCHW-FP16-F=ConvBinWinogradRxSf2x3g1:0.38948,0,miopenConvolutionFwdAlgoWinograd;ConvBinWinogradRxSf3x2:0.38096,0,miopenConvolutionFwdAlgoWinograd;GemmFwdRest:0.53272,2949120,miopenConvolutionFwdAlgoGEMM;ConvDirectNaiveConvFwd:20.4011,0,miopenConvolutionFwdAlgoDirect
640-16-16-3x3-1280-16-16-2-1x1-1x1-1x1-0-NCHW-FP16-F=ConvBinWinogradRxSf2x3g1:0.1964,0,miopenConvolutionFwdAlgoWinograd;ConvBinWinogradRxSf3x2:0.52212,0,miopenConvolutionFwdAlgoWinograd;GemmFwdRest:0.95304,2949120,miopenConvolutionFwdAlgoGEMM;ConvDirectNaiveConvFwd:40.4029,0,miopenConvolutionFwdAlgoDirect
1280-16-16-3x3-1280-16-16-2-1x1-1x1-1x1-0-NCHW-FP16-F=ConvBinWinogradRxSf2x3g1:0.36444,0,miopenConvolutionFwdAlgoWinograd;ConvBinWinogradRxSf3x2:1.00776,0,miopenConvolutionFwdAlgoWinograd;GemmFwdRest:1.79032,5898240,miopenConvolutionFwdAlgoGEMM;ConvDirectNaiveConvFwd:80.9425,0,miopenConvolutionFwdAlgoDirect
640-16-16-1x1-1280-16-16-2-0x0-1x1-1x1-0-NCHW-FP16-F=ConvBinWinogradRxSf2x3g1:0.19152,0,miopenConvolutionFwdAlgoWinograd;ConvBinWinogradRxSf3x2:0.14976,0,miopenConvolutionFwdAlgoWinograd;GemmFwd1x1_0_1:0.06164,0,miopenConvolutionFwdAlgoGEMM;ConvDirectNaiveConvFwd:5.60696,0,miopenConvolutionFwdAlgoDirect
1280-16-16-1x1-1280-16-16-2-0x0-1x1-1x1-0-NCHW-FP16-F=ConvBinWinogradRxSf2x3g1:0.36436,0,miopenConvolutionFwdAlgoWinograd;ConvBinWinogradRxSf3x2:0.27032,0,miopenConvolutionFwdAlgoWinograd;GemmFwd1x1_0_1:0.1118,0,miopenConvolutionFwdAlgoGEMM;ConvDirectNaiveConvFwd:11.1851,0,miopenConvolutionFwdAlgoDirect
1280-16-16-3x3-1280-8-8-2-1x1-2x2-1x1-0-NCHW-FP16-F=ConvBinWinogradRxSf2x3g1:0.39012,0,miopenConvolutionFwdAlgoWinograd;ConvBinWinogradRxSf3x2:0.37904,0,miopenConvolutionFwdAlgoWinograd;GemmFwdRest:1.70424,1474560,miopenConvolutionFwdAlgoGEMM;ConvDirectNaiveConvFwd:20.9648,0,miopenConvolutionFwdAlgoDirect
1280-8-8-3x3-1280-8-8-2-1x1-1x1-1x1-0-NCHW-FP16-F=ConvBinWinogradRxSf2x3g1:0.11448,0,miopenConvolutionFwdAlgoWinograd;ConvBinWinogradRxSf3x2:0.35828,0,miopenConvolutionFwdAlgoWinograd;GemmFwdRest:1.85208,1474560,miopenConvolutionFwdAlgoGEMM;ConvDirectNaiveConvFwd:21.2087,0,miopenConvolutionFwdAlgoDirect
1280-8-8-1x1-1280-8-8-2-0x0-1x1-1x1-0-NCHW-FP16-F=ConvBinWinogradRxSf2x3g1:0.10228,0,miopenConvolutionFwdAlgoWinograd;ConvBinWinogradRxSf3x2:0.1092,0,miopenConvolutionFwdAlgoWinograd;GemmFwd1x1_0_1:0.06544,0,miopenConvolutionFwdAlgoGEMM;ConvDirectNaiveConvFwd:3.1052,0,miopenConvolutionFwdAlgoDirect
2560-8-8-3x3-1280-8-8-2-1x1-1x1-1x1-0-NCHW-FP16-F=ConvBinWinogradRxSf2x3g1:0.19776,0,miopenConvolutionFwdAlgoWinograd;ConvBinWinogradRxSf3x2:0.67812,0,miopenConvolutionFwdAlgoWinograd;GemmFwdRest:3.37904,2949120,miopenConvolutionFwdAlgoGEMM;ConvDirectNaiveConvFwd:41.8293,0,miopenConvolutionFwdAlgoDirect
2560-8-8-1x1-1280-8-8-2-0x0-1x1-1x1-0-NCHW-FP16-F=ConvBinWinogradRxSf2x3g1:0.18924,0,miopenConvolutionFwdAlgoWinograd;ConvBinWinogradRxSf3x2:0.18484,0,miopenConvolutionFwdAlgoWinograd;GemmFwd1x1_0_1:0.12684,0,miopenConvolutionFwdAlgoGEMM;ConvDirectNaiveConvFwd:5.85932,0,miopenConvolutionFwdAlgoDirect
2560-16-16-3x3-1280-16-16-2-1x1-1x1-1x1-0-NCHW-FP16-F=ConvBinWinogradRxSf2x3g1:0.71684,0,miopenConvolutionFwdAlgoWinograd;ConvBinWinogradRxSf3x2:2.00736,0,miopenConvolutionFwdAlgoWinograd;GemmFwdRest:3.90744,11796480,miopenConvolutionFwdAlgoGEMM;ConvDirectNaiveConvFwd:163.122,0,miopenConvolutionFwdAlgoDirect
2560-16-16-1x1-1280-16-16-2-0x0-1x1-1x1-0-NCHW-FP16-F=ConvBinWinogradRxSf2x3g1:0.70492,0,miopenConvolutionFwdAlgoWinograd;ConvBinWinogradRxSf3x2:0.51868,0,miopenConvolutionFwdAlgoWinograd;GemmFwd1x1_0_1:0.21768,0,miopenConvolutionFwdAlgoGEMM;ConvDirectNaiveConvFwd:22.5448,0,miopenConvolutionFwdAlgoDirect
1920-16-16-3x3-1280-16-16-2-1x1-1x1-1x1-0-NCHW-FP16-F=ConvBinWinogradRxSf2x3g1:0.5458,0,miopenConvolutionFwdAlgoWinograd;ConvBinWinogradRxSf3x2:1.50328,0,miopenConvolutionFwdAlgoWinograd;GemmFwdRest:2.11944,8847360,miopenConvolutionFwdAlgoGEMM;ConvDirectNaiveConvFwd:121.431,0,miopenConvolutionFwdAlgoDirect
1920-16-16-1x1-1280-16-16-2-0x0-1x1-1x1-0-NCHW-FP16-F=ConvBinWinogradRxSf2x3g1:0.536841,0,miopenConvolutionFwdAlgoWinograd;ConvBinWinogradRxSf3x2:0.3996,0,miopenConvolutionFwdAlgoWinograd;GemmFwd1x1_0_1:0.30532,0,miopenConvolutionFwdAlgoGEMM;ConvDirectNaiveConvFwd:16.8194,0,miopenConvolutionFwdAlgoDirect
1280-32-32-3x3-1280-32-32-2-1x1-1x1-1x1-0-NCHW-FP16-F=ConvBinWinogradRxSf2x3g1:1.41932,0,miopenConvolutionFwdAlgoWinograd;ConvBinWinogradRxSf3x2:2.66644,0,miopenConvolutionFwdAlgoWinograd;GemmFwdRest:4.0708,23592960,miopenConvolutionFwdAlgoGEMM;ConvDirectNaiveConvFwd:323.96,0,miopenConvolutionFwdAlgoDirect
1920-32-32-3x3-640-32-32-2-1x1-1x1-1x1-0-NCHW-FP16-F=ConvBinWinogradRxSf2x3g1:1.07256,0,miopenConvolutionFwdAlgoWinograd;ConvBinWinogradRxSf3x2:2.00268,0,miopenConvolutionFwdAlgoWinograd;GemmFwdRest:3.67064,35389440,miopenConvolutionFwdAlgoGEMM;ConvDirectNaiveConvFwd:251.354,0,miopenConvolutionFwdAlgoDirect
1920-32-32-1x1-640-32-32-2-0x0-1x1-1x1-0-NCHW-FP16-F=ConvBinWinogradRxSf2x3g1:1.05208,0,miopenConvolutionFwdAlgoWinograd;ConvBinWinogradRxSf3x2:0.52204,0,miopenConvolutionFwdAlgoWinograd;GemmFwd1x1_0_1:0.29204,0,miopenConvolutionFwdAlgoGEMM;ConvDirectNaiveConvFwd:35.4404,0,miopenConvolutionFwdAlgoDirect
1280-32-32-3x3-640-32-32-2-1x1-1x1-1x1-0-NCHW-FP16-F=ConvBinWinogradRxSf2x3g1:0.72696,0,miopenConvolutionFwdAlgoWinograd;ConvBinWinogradRxSf3x2:1.34912,0,miopenConvolutionFwdAlgoWinograd;GemmFwdRest:3.04536,23592960,miopenConvolutionFwdAlgoGEMM;ConvDirectNaiveConvFwd:164.607,0,miopenConvolutionFwdAlgoDirect
1280-32-32-1x1-640-32-32-2-0x0-1x1-1x1-0-NCHW-FP16-F=ConvBinWinogradRxSf2x3g1:0.7122,0,miopenConvolutionFwdAlgoWinograd;ConvBinWinogradRxSf3x2:0.3628,0,miopenConvolutionFwdAlgoWinograd;GemmFwd1x1_0_1:0.21124,0,miopenConvolutionFwdAlgoGEMM;ConvDirectNaiveConvFwd:23.0234,0,miopenConvolutionFwdAlgoDirect
960-32-32-3x3-640-32-32-2-1x1-1x1-1x1-0-NCHW-FP16-F=ConvBinWinogradRxSf2x3g1:0.5528,0,miopenConvolutionFwdAlgoWinograd;ConvBinWinogradRxSf3x2:1.01976,0,miopenConvolutionFwdAlgoWinograd;GemmFwdRest:2.29712,17694720,miopenConvolutionFwdAlgoGEMM;ConvDirectNaiveConvFwd:122.93,0,miopenConvolutionFwdAlgoDirect
960-32-32-1x1-640-32-32-2-0x0-1x1-1x1-0-NCHW-FP16-F=ConvBinWinogradRxSf2x3g1:0.54188,0,miopenConvolutionFwdAlgoWinograd;ConvBinWinogradRxSf3x2:0.28092,0,miopenConvolutionFwdAlgoWinograd;GemmFwd1x1_0_1:0.163,0,miopenConvolutionFwdAlgoGEMM;ConvDirectNaiveConvFwd:17.2142,0,miopenConvolutionFwdAlgoDirect
640-64-64-3x3-640-64-64-2-1x1-1x1-1x1-0-NCHW-FP16-F=ConvBinWinogradRxSf2x3g1:1.42892,0,miopenConvolutionFwdAlgoWinograd;ConvBinWinogradRxSf3x2:2.68348,0,miopenConvolutionFwdAlgoWinograd;GemmFwdRest:4.34176,47185920,miopenConvolutionFwdAlgoGEMM;ConvDirectNaiveConvFwd:335.968,0,miopenConvolutionFwdAlgoDirect
960-64-64-3x3-320-64-64-2-1x1-1x1-1x1-0-NCHW-FP16-F=ConvBinWinogradRxSf2x3g1:1.0806,0,miopenConvolutionFwdAlgoWinograd;ConvBinWinogradRxSf3x2:2.01584,0,miopenConvolutionFwdAlgoWinograd;GemmFwdRest:5.0636,70778880,miopenConvolutionFwdAlgoGEMM;ConvDirectNaiveConvFwd:257.28,0,miopenConvolutionFwdAlgoDirect
960-64-64-1x1-320-64-64-2-0x0-1x1-1x1-0-NCHW-FP16-F=ConvBinWinogradRxSf2x3g1:1.06244,0,miopenConvolutionFwdAlgoWinograd;ConvBinWinogradRxSf3x2:0.5306,0,miopenConvolutionFwdAlgoWinograd;GemmFwd1x1_0_1:0.3212,0,miopenConvolutionFwdAlgoGEMM;ConvDirectNaiveConvFwd:36.3708,0,miopenConvolutionFwdAlgoDirect
640-64-64-3x3-320-64-64-2-1x1-1x1-1x1-0-NCHW-FP16-F=ConvBinWinogradRxSf2x3g1:0.732,0,miopenConvolutionFwdAlgoWinograd;ConvBinWinogradRxSf3x2:1.36064,0,miopenConvolutionFwdAlgoWinograd;GemmFwdRest:2.42952,47185920,miopenConvolutionFwdAlgoGEMM;ConvDirectNaiveConvFwd:169.974,0,miopenConvolutionFwdAlgoDirect
640-64-64-1x1-320-64-64-2-0x0-1x1-1x1-0-NCHW-FP16-F=ConvBinWinogradRxSf2x3g1:0.72088,0,miopenConvolutionFwdAlgoWinograd;ConvBinWinogradRxSf3x2:0.3714,0,miopenConvolutionFwdAlgoWinograd;GemmFwd1x1_0_1:0.22352,0,miopenConvolutionFwdAlgoGEMM;ConvDirectNaiveConvFwd:25.0793,0,miopenConvolutionFwdAlgoDirect
320-64-64-3x3-4-64-64-2-1x1-1x1-1x1-0-NCHW-FP16-F=ConvBinWinogradRxSf2x3g1:0.0654,0,miopenConvolutionFwdAlgoWinograd;ConvBinWinogradRxSf3x2:0.10812,0,miopenConvolutionFwdAlgoWinograd;GemmFwdRest:0.40912,23592960,miopenConvolutionFwdAlgoGEMM;ConvDirectNaiveConvFwd:7.5014,0,miopenConvolutionFwdAlgoDirect
4-64-64-1x1-4-64-64-1-0x0-1x1-1x1-0-NCHW-FP32-F=ConvBinWinogradRxSf2x3g1:0.01744,0,miopenConvolutionFwdAlgoWinograd;ConvBinWinogradRxSf3x2:0.02468,0,miopenConvolutionFwdAlgoWinograd;GemmFwd1x1_0_1:0.01712,0,miopenConvolutionFwdAlgoGEMM;ConvDirectNaiveConvFwd:0.0276,0,miopenConvolutionFwdAlgoDirect
4-64-64-3x3-512-64-64-1-1x1-1x1-1x1-0-NCHW-FP32-F=ConvBinWinogradRxSf2x3g1:0.03664,0,miopenConvolutionFwdAlgoWinograd;ConvBinWinogradRxSf3x2:0.06196,0,miopenConvolutionFwdAlgoWinograd;GemmFwdRest:0.04552,589824,miopenConvolutionFwdAlgoGEMM;ConvDirectNaiveConvFwd:1.15972,0,miopenConvolutionFwdAlgoDirect
512-64-64-3x3-512-64-64-1-1x1-1x1-1x1-0-NCHW-FP32-F=ConvBinWinogradRxSf2x3g1:0.87884,0,miopenConvolutionFwdAlgoWinograd;ConvBinWinogradRxSf3x2:1.79064,0,miopenConvolutionFwdAlgoWinograd;GemmFwdRest:2.3456,75497472,miopenConvolutionFwdAlgoGEMM;ConvDirectNaiveConvFwd:104.417,0,miopenConvolutionFwdAlgoDirect
512-64-64-1x1-512-64-64-1-0x0-1x1-1x1-0-NCHW-FP32-F=ConvBinWinogradRxSf2x3g1:0.86492,0,miopenConvolutionFwdAlgoWinograd;ConvBinWinogradRxSf3x2:0.47596,0,miopenConvolutionFwdAlgoWinograd;GemmFwd1x1_0_1:0.21744,0,miopenConvolutionFwdAlgoGEMM;ConvDirectNaiveConvFwd:14.7333,0,miopenConvolutionFwdAlgoDirect
512-128-128-3x3-512-128-128-1-1x1-1x1-1x1-0-NCHW-FP32-F=ConvBinWinogradRxSf2x3g1:3.42944,0,miopenConvolutionFwdAlgoWinograd;ConvBinWinogradRxSf3x2:6.06844,0,miopenConvolutionFwdAlgoWinograd;GemmFwdRest:10.2654,301989888,miopenConvolutionFwdAlgoGEMM;ConvDirectNaiveConvFwd:427.71,0,miopenConvolutionFwdAlgoDirect
512-256-256-3x3-512-256-256-1-1x1-1x1-1x1-0-NCHW-FP32-F=ConvBinWinogradRxSf2x3g1:15.9518,0,miopenConvolutionFwdAlgoWinograd;ConvBinWinogradRxSf3x2:26.4205,0,miopenConvolutionFwdAlgoWinograd;GemmFwdRest:45.5634,1207959552,miopenConvolutionFwdAlgoGEMM;ConvDirectNaiveConvFwd:1810.38,0,miopenConvolutionFwdAlgoDirect
512-256-256-3x3-256-256-256-1-1x1-1x1-1x1-0-NCHW-FP32-F=ConvBinWinogradRxSf2x3g1:6.93596,0,miopenConvolutionFwdAlgoWinograd;ConvBinWinogradRxSf3x2:12.1246,0,miopenConvolutionFwdAlgoWinograd;GemmFwdRest:27.315,1207959552,miopenConvolutionFwdAlgoGEMM;ConvDirectNaiveConvFwd:1092.35,0,miopenConvolutionFwdAlgoDirect
512-256-256-1x1-256-256-256-1-0x0-1x1-1x1-0-NCHW-FP32-F=ConvBinWinogradRxSf2x3g1:6.8152,0,miopenConvolutionFwdAlgoWinograd;ConvBinWinogradRxSf3x2:3.6788,0,miopenConvolutionFwdAlgoWinograd;GemmFwd1x1_0_1:2.08204,0,miopenConvolutionFwdAlgoGEMM;ConvDirectNaiveConvFwd:154.981,0,miopenConvolutionFwdAlgoDirect
256-512-512-3x3-256-512-512-1-1x1-1x1-1x1-0-NCHW-FP32-F=ConvBinWinogradRxSf2x3g1:14.2099,0,miopenConvolutionFwdAlgoWinograd;ConvBinWinogradRxSf3x2:23.4794,0,miopenConvolutionFwdAlgoWinograd;GemmFwdRest:40.72,2415919104,miopenConvolutionFwdAlgoGEMM;ConvDirectNaiveConvFwd:2209.72,0,miopenConvolutionFwdAlgoDirect
256-512-512-3x3-128-512-512-1-1x1-1x1-1x1-0-NCHW-FP32-F=ConvBinWinogradRxSf2x3g1:7.10668,0,miopenConvolutionFwdAlgoWinograd;ConvBinWinogradRxSf3x2:11.9046,0,miopenConvolutionFwdAlgoWinograd;GemmFwdRest:26.3865,2415919104,miopenConvolutionFwdAlgoGEMM;ConvDirectNaiveConvFwd:1321.44,0,miopenConvolutionFwdAlgoDirect
128-512-512-3x3-128-512-512-1-1x1-1x1-1x1-0-NCHW-FP32-F=ConvBinWinogradRxSf2x3g1:3.68668,0,miopenConvolutionFwdAlgoWinograd;ConvBinWinogradRxSf3x2:6.09584,0,miopenConvolutionFwdAlgoWinograd;GemmFwdRest:14.1436,1207959552,miopenConvolutionFwdAlgoGEMM;ConvDirectNaiveConvFwd:671.528,0,miopenConvolutionFwdAlgoDirect
256-512-512-1x1-128-512-512-1-0x0-1x1-1x1-0-NCHW-FP32-F=ConvBinWinogradRxSf2x3g1:6.90532,0,miopenConvolutionFwdAlgoWinograd;ConvBinWinogradRxSf3x2:3.49156,0,miopenConvolutionFwdAlgoWinograd;GemmFwd1x1_0_1:1.63508,0,miopenConvolutionFwdAlgoGEMM;ConvDirectNaiveConvFwd:192.337,0,miopenConvolutionFwdAlgoDirect
128-512-512-3x3-3-512-512-1-1x1-1x1-1x1-0-NCHW-FP32-F=ConvBinWinogradRxSf2x3g1:0.90396,0,miopenConvolutionFwdAlgoWinograd;ConvBinWinogradRxSf3x2:1.49024,0,miopenConvolutionFwdAlgoWinograd;GemmFwdRest:13.9956,1207959552,miopenConvolutionFwdAlgoGEMM;ConvDirectNaiveConvFwd:312.563,0,miopenConvolutionFwdAlgoDirect
